{
  "id": "sla-overview",
  "title": "SLA overview",
  "category": "citation-heavy",
  "sourceUri": "fixture://research/citation-heavy/sla-overview",
  "htmlPath": "fixtures/research/citation-heavy/sla-overview/index.html",
  "expectedSnapshotPath": "fixtures/research/citation-heavy/sla-overview/expected-snapshot.json",
  "expectedEvidencePath": "fixtures/research/citation-heavy/sla-overview/expected-evidence.json",
  "risk": "low",
  "expectations": {
    "mustContainTexts": [
      "SLA Overview",
      "SLA Overview states that Priority incidents receive updates every 30 minutes.",
      "Priority | 30 minutes | 99.9"
    ],
    "expectedKinds": ["heading", "text", "table", "link"],
    "expectedCitationUrl": "fixture://research/citation-heavy/sla-overview",
    "claimChecks": [
      {
        "id": "c1",
        "statement": "SLA Overview states that Priority incidents receive updates every 30 minutes.",
        "expectedStatus": "supported"
      },
      {
        "id": "c2",
        "statement": "Priority | 30 minutes | 99.9",
        "expectedStatus": "supported"
      },
      {
        "id": "c3",
        "statement": "The SLA overview includes a payroll form.",
        "expectedStatus": "needs-more-browsing"
      }
    ]
  }
}
