{
  "id": "pricing",
  "title": "Citation-heavy pricing page",
  "category": "citation-heavy",
  "sourceUri": "fixture://research/citation-heavy/pricing",
  "htmlPath": "fixtures/research/citation-heavy/pricing/index.html",
  "expectedSnapshotPath": "fixtures/research/citation-heavy/pricing/expected-snapshot.json",
  "expectedEvidencePath": "fixtures/research/citation-heavy/pricing/expected-evidence.json",
  "risk": "low",
  "expectations": {
    "mustContainTexts": [
      "Pricing",
      "Starter",
      "citation-ready evidence blocks"
    ],
    "expectedKinds": ["heading", "text", "table"],
    "expectedCitationUrl": "fixture://research/citation-heavy/pricing",
    "claimChecks": [
      {
        "id": "c1",
        "statement": "The Starter plan costs $29 per month.",
        "expectedStatus": "supported"
      },
      {
        "id": "c2",
        "statement": "All plans include citation-ready evidence blocks.",
        "expectedStatus": "supported"
      },
      {
        "id": "c3",
        "statement": "There is an Enterprise plan.",
        "expectedStatus": "unsupported"
      }
    ]
  }
}
